<?xml version="1.0" encoding="ISO-8859-1"?>
<?xml-stylesheet type="text/xsl" href="../../../xsl/Account2xml.xsl"?>
<!DOCTYPE Account SYSTEM "../../../dtd/Account.dtd">
<Account>
  <name>Telefoonkosten</name>
  <action id="24">
    <nr>DIV24</nr>
    <journal_xml>../Journals/Diversen.xml</journal_xml>
    <journal_html>../Journals/Diversen.html</journal_html>
    <date>30/1/2012</date>
    <debit>362.96</debit>
    <description>101103438942650</description>
  </action>
  <action id="68">
    <nr>DIV68</nr>
    <journal_xml>../Journals/Diversen.xml</journal_xml>
    <journal_html>../Journals/Diversen.html</journal_html>
    <date>27/2/2012</date>
    <debit>277.03</debit>
    <description>101103438942751</description>
  </action>
  <action id="136">
    <nr>DIV136</nr>
    <journal_xml>../Journals/Diversen.xml</journal_xml>
    <journal_html>../Journals/Diversen.html</journal_html>
    <date>5/4/2012</date>
    <debit>15.00</debit>
    <description>101011047087496</description>
  </action>
  <action id="140">
    <nr>DIV140</nr>
    <journal_xml>../Journals/Diversen.xml</journal_xml>
    <journal_html>../Journals/Diversen.html</journal_html>
    <date>5/4/2012</date>
    <debit>161.26</debit>
    <description>101103438942852</description>
  </action>
  <action id="166">
    <nr>DIV166</nr>
    <journal_xml>../Journals/Diversen.xml</journal_xml>
    <journal_html>../Journals/Diversen.html</journal_html>
    <date>24/4/2012</date>
    <debit>222.77</debit>
    <description>101103438942953</description>
  </action>
  <action id="226">
    <nr>DIV226</nr>
    <journal_xml>../Journals/Diversen.xml</journal_xml>
    <journal_html>../Journals/Diversen.html</journal_html>
    <date>29/5/2012</date>
    <debit>120.54</debit>
    <description>101103438943054</description>
  </action>
  <action id="409">
    <nr>DIV409</nr>
    <journal_xml>../Journals/Diversen.xml</journal_xml>
    <journal_html>../Journals/Diversen.html</journal_html>
    <date>20/8/2012</date>
    <debit>12.31</debit>
    <description>KCLEU326995305</description>
  </action>
  <action id="418">
    <nr>DIV418</nr>
    <journal_xml>../Journals/Diversen.xml</journal_xml>
    <journal_html>../Journals/Diversen.html</journal_html>
    <date>28/8/2012</date>
    <debit>280.01</debit>
    <description>10343894</description>
  </action>
  <action id="455">
    <nr>DIV455</nr>
    <journal_xml>../Journals/Diversen.xml</journal_xml>
    <journal_html>../Journals/Diversen.html</journal_html>
    <date>19/9/2012</date>
    <debit>182.65</debit>
    <description>101103438943458</description>
  </action>
  <action id="456">
    <nr>DIV456</nr>
    <journal_xml>../Journals/Diversen.xml</journal_xml>
    <journal_html>../Journals/Diversen.html</journal_html>
    <date>19/9/2012</date>
    <debit>196.06</debit>
    <description>10343894</description>
  </action>
  <action id="497">
    <nr>DIV497</nr>
    <journal_xml>../Journals/Diversen.xml</journal_xml>
    <journal_html>../Journals/Diversen.html</journal_html>
    <date>15/10/2012</date>
    <debit>12.31</debit>
    <description>KCLEU326995305</description>
  </action>
  <action id="514">
    <nr>DIV514</nr>
    <journal_xml>../Journals/Diversen.xml</journal_xml>
    <journal_html>../Journals/Diversen.html</journal_html>
    <date>30/10/2012</date>
    <debit>360.93</debit>
    <description>101103438943559</description>
  </action>
  <action id="551">
    <nr>DIV551</nr>
    <journal_xml>../Journals/Diversen.xml</journal_xml>
    <journal_html>../Journals/Diversen.html</journal_html>
    <date>23/11/2012</date>
    <debit>222.67</debit>
    <description>101103438943660</description>
  </action>
  <action id="606">
    <nr>DIV606</nr>
    <journal_xml>../Journals/Diversen.xml</journal_xml>
    <journal_html>../Journals/Diversen.html</journal_html>
    <date>21/12/2012</date>
    <debit>242.91</debit>
    <description>Proximus</description>
  </action>
  <closed type = "debit">
    <debitTotal>2669.41</debitTotal>
    <creditTotal>0.00</creditTotal>
    <saldo>2669.41</saldo>
  </closed>
</Account>