<?xml version="1.0" encoding="ISO-8859-1"?>
<?xml-stylesheet type="text/xsl" href="C:\Users\Dafke\workspace\trunk\Accounting\src\main\resources\xsl\Account2xml.xsl"?>
<!DOCTYPE Account SYSTEM "C:\Users\Dafke\workspace\trunk\Accounting\src\main\resources\dtd\Account.dtd">
<Account>
  <name>Energiekosten</name>
  <action id="532">
    <nr>DIV532</nr>
    <journal_xml>C:\Users\Dafke\workspace\trunk\Accounting\src\main\resources\xml\Thuis 2012\Journals\Diversen.xml</journal_xml>
    <journal_html>null</journal_html>
    <date>6/11/2012</date>
    <debit>600.00</debit>
    <description>voorgeschoten door ma: dokter-apotheek-gas-electriciteit</description>
  </action>
  <closed type = "debit">
    <debitTotal>600.00</debitTotal>
    <creditTotal>0.00</creditTotal>
    <saldo>600.00</saldo>
  </closed>
</Account>