<?xml version="1.0" encoding="ISO-8859-1"?>
<?xml-stylesheet type="text/xsl" href="C:\Users\Dafke\workspace\trunk\Accounting\src\main\resources\xsl\Account2xml.xsl"?>
<!DOCTYPE Account SYSTEM "C:\Users\Dafke\workspace\trunk\Accounting\src\main\resources\dtd\Account.dtd">
<Account>
  <name>Post Dara</name>
  <action id="5">
    <nr>DIV5</nr>
    <journal_xml>C:\Users\Dafke\workspace\trunk\Accounting\src\main\resources\xml\Thuis 2012\Journals\Diversen.xml</journal_xml>
    <journal_html>null</journal_html>
    <date>10/1/2012</date>
    <debit>100.00</debit>
    <description>storting</description>
  </action>
  <action id="11">
    <nr>DIV11</nr>
    <journal_xml>C:\Users\Dafke\workspace\trunk\Accounting\src\main\resources\xml\Thuis 2012\Journals\Diversen.xml</journal_xml>
    <journal_html>null</journal_html>
    <date>17/1/2012</date>
    <debit>100.00</debit>
    <description>storting</description>
  </action>
  <action id="17">
    <nr>DIV17</nr>
    <journal_xml>C:\Users\Dafke\workspace\trunk\Accounting\src\main\resources\xml\Thuis 2012\Journals\Diversen.xml</journal_xml>
    <journal_html>null</journal_html>
    <date>20/1/2012</date>
    <debit>113.54</debit>
    <description>storting</description>
  </action>
  <action id="31">
    <nr>DIV31</nr>
    <journal_xml>C:\Users\Dafke\workspace\trunk\Accounting\src\main\resources\xml\Thuis 2012\Journals\Diversen.xml</journal_xml>
    <journal_html>null</journal_html>
    <date>3/2/2012</date>
    <debit>312.86</debit>
    <description>storting</description>
  </action>
  <action id="53">
    <nr>DIV53</nr>
    <journal_xml>C:\Users\Dafke\workspace\trunk\Accounting\src\main\resources\xml\Thuis 2012\Journals\Diversen.xml</journal_xml>
    <journal_html>null</journal_html>
    <date>17/2/2012</date>
    <debit>202.49</debit>
    <description>storting</description>
  </action>
  <action id="64">
    <nr>DIV64</nr>
    <journal_xml>C:\Users\Dafke\workspace\trunk\Accounting\src\main\resources\xml\Thuis 2012\Journals\Diversen.xml</journal_xml>
    <journal_html>null</journal_html>
    <date>24/2/2012</date>
    <debit>214.02</debit>
    <description>storting</description>
  </action>
  <action id="76">
    <nr>DIV76</nr>
    <journal_xml>C:\Users\Dafke\workspace\trunk\Accounting\src\main\resources\xml\Thuis 2012\Journals\Diversen.xml</journal_xml>
    <journal_html>null</journal_html>
    <date>2/3/2012</date>
    <debit>113.23</debit>
    <description>storting</description>
  </action>
  <action id="100">
    <nr>DIV100</nr>
    <journal_xml>C:\Users\Dafke\workspace\trunk\Accounting\src\main\resources\xml\Thuis 2012\Journals\Diversen.xml</journal_xml>
    <journal_html>null</journal_html>
    <date>16/3/2012</date>
    <debit>203.60</debit>
    <description>storting</description>
  </action>
  <action id="118">
    <nr>DIV118</nr>
    <journal_xml>C:\Users\Dafke\workspace\trunk\Accounting\src\main\resources\xml\Thuis 2012\Journals\Diversen.xml</journal_xml>
    <journal_html>null</journal_html>
    <date>23/3/2012</date>
    <debit>130.00</debit>
    <description>storting</description>
  </action>
  <action id="157">
    <nr>DIV157</nr>
    <journal_xml>C:\Users\Dafke\workspace\trunk\Accounting\src\main\resources\xml\Thuis 2012\Journals\Diversen.xml</journal_xml>
    <journal_html>null</journal_html>
    <date>17/4/2012</date>
    <debit>440.00</debit>
    <description>storting</description>
  </action>
  <action id="174">
    <nr>DIV174</nr>
    <journal_xml>C:\Users\Dafke\workspace\trunk\Accounting\src\main\resources\xml\Thuis 2012\Journals\Diversen.xml</journal_xml>
    <journal_html>null</journal_html>
    <date>29/4/2012</date>
    <debit>100.00</debit>
    <description>storting</description>
  </action>
  <action id="309">
    <nr>DIV309</nr>
    <journal_xml>C:\Users\Dafke\workspace\trunk\Accounting\src\main\resources\xml\Thuis 2012\Journals\Diversen.xml</journal_xml>
    <journal_html>null</journal_html>
    <date>5/7/2012</date>
    <debit>300.00</debit>
    <description>storting</description>
  </action>
  <action id="339">
    <nr>DIV339</nr>
    <journal_xml>C:\Users\Dafke\workspace\trunk\Accounting\src\main\resources\xml\Thuis 2012\Journals\Diversen.xml</journal_xml>
    <journal_html>null</journal_html>
    <date>18/7/2012</date>
    <debit>190.96</debit>
    <description>storting</description>
  </action>
  <action id="411">
    <nr>DIV411</nr>
    <journal_xml>C:\Users\Dafke\workspace\trunk\Accounting\src\main\resources\xml\Thuis 2012\Journals\Diversen.xml</journal_xml>
    <journal_html>null</journal_html>
    <date>21/8/2012</date>
    <debit>286.18</debit>
    <description>storting</description>
  </action>
  <action id="419">
    <nr>DIV419</nr>
    <journal_xml>C:\Users\Dafke\workspace\trunk\Accounting\src\main\resources\xml\Thuis 2012\Journals\Diversen.xml</journal_xml>
    <journal_html>null</journal_html>
    <date>28/8/2012</date>
    <credit>100.00</credit>
    <description>Afhaling</description>
  </action>
  <action id="448">
    <nr>DIV448</nr>
    <journal_xml>C:\Users\Dafke\workspace\trunk\Accounting\src\main\resources\xml\Thuis 2012\Journals\Diversen.xml</journal_xml>
    <journal_html>null</journal_html>
    <date>13/9/2012</date>
    <debit>100.00</debit>
    <description>storting</description>
  </action>
  <action id="478">
    <nr>DIV478</nr>
    <journal_xml>C:\Users\Dafke\workspace\trunk\Accounting\src\main\resources\xml\Thuis 2012\Journals\Diversen.xml</journal_xml>
    <journal_html>null</journal_html>
    <date>3/10/2012</date>
    <credit>2200.00</credit>
    <description>aankoop tickets februari</description>
  </action>
  <action id="484">
    <nr>DIV484</nr>
    <journal_xml>C:\Users\Dafke\workspace\trunk\Accounting\src\main\resources\xml\Thuis 2012\Journals\Diversen.xml</journal_xml>
    <journal_html>null</journal_html>
    <date>7/10/2012</date>
    <debit>100.00</debit>
    <description>
  </description>
  </action>
  <action id="535">
    <nr>DIV535</nr>
    <journal_xml>C:\Users\Dafke\workspace\trunk\Accounting\src\main\resources\xml\Thuis 2012\Journals\Diversen.xml</journal_xml>
    <journal_html>null</journal_html>
    <date>6/11/2012</date>
    <credit>700.00</credit>
    <description>
  </description>
  </action>
  <action id="601">
    <nr>DIV601</nr>
    <journal_xml>C:\Users\Dafke\workspace\trunk\Accounting\src\main\resources\xml\Thuis 2012\Journals\Diversen.xml</journal_xml>
    <journal_html>null</journal_html>
    <date>18/12/2012</date>
    <debit>2500.00</debit>
    <description>overschot feestje</description>
  </action>
  <closed type = "debit">
    <debitTotal>5506.88</debitTotal>
    <creditTotal>3000.00</creditTotal>
    <saldo>2506.88</saldo>
  </closed>
</Account>