<?xml version="1.0" encoding="ISO-8859-1"?>
<?xml-stylesheet type="text/xsl" href="C:\Users\Dafke\workspace\trunk\Accounting\src\main\resources\xsl\Account2xml.xsl"?>
<!DOCTYPE Account SYSTEM "C:\Users\Dafke\workspace\trunk\Accounting\src\main\resources\dtd\Account.dtd">
<Account>
  <name>Vakantiegeld David</name>
  <action id="229">
    <nr>DIV229</nr>
    <journal_xml>C:\Users\Dafke\workspace\trunk\Accounting\src\main\resources\xml\Thuis 2012\Journals\Diversen.xml</journal_xml>
    <journal_html>null</journal_html>
    <date>31/5/2012</date>
    <credit>190.71</credit>
    <description>/A/ 91RLMJ11 Vakantiegeld 2012</description>
  </action>
  <closed type = "credit">
    <debitTotal>0.00</debitTotal>
    <creditTotal>190.71</creditTotal>
    <saldo>190.71</saldo>
  </closed>
</Account>